id,naslov_sr,naslov_en,slug,status,objavljeno,kategorije,excerpt_sr,excerpt_en,sadrzaj_sr,naslovna_slika,galerija_slike,broj_slika,video_url,meta_naslov_sr,meta_opis_sr,kreiran,azuriran,podkategorija
860,EUROFENCE 3D PANELNA OGRADA,,eurofence-3d-panelna-ograda-4,published,2025-05-19T08:16:37.000Z,gotovi-projekti,"Na privatnom posedu u Šimanovcima postavljena je EUROFENCE 3D panelna ograda u boji RAL6005 (zelena). Ova ograda je jedno od najtraženijih rešenja u našoj ponudi zahvaljujući svojoj funkcionalnosti,…",,"Na privatnom posedu u Šimanovcima postavljena je EUROFENCE 3D panelna ograda u boji RAL6005 (zelena). Ova ograda je jedno od najtraženijih rešenja u našoj ponudi zahvaljujući svojoj funkcionalnosti, izdržljivosti i estetskom izgledu koji se lako uklapa u različita okruženja.
Karakteristike EUROFENCE 3D panelne ograde
 Boja i dizajn: Izabrana nijansa RAL6005 zelena doprinosi prirodnom uklapanju u pejzaž, idealna je za privatne posede, vikendice, dvorišta i druge stambene ili rekreativne objekte. 
 Materijal i trajnost: Paneli su izrađeni od pocinčanog čelika, dodatno plastificirani, što im pruža dug vek trajanja i otpornost na spoljne uticaje. 
 Popularnost: Model EUROFENCE 3D u boji RAL6005 je naš najprodavaniji proizvod iz kategorije panelnih ograda. 
Dvokrilna kapija LIGHT sa panelnom ispunom
Uz panelnu ogradu na objektu je postavljena i dvokrilna kapija LIGHT, izrađena od toplocinkovanih i plastificiranih čeličnih profila, sa panelnom ispunom istog tipa i boje kao i ograda. Ovakvo rešenje omogućava jedinstven izgled kompletnog ograđenog prostora i funkcionalan ulaz u dvorište.
Više informacija o proizvodima:
 EUROFENCE 3D panelna ograda 
 Dvokrilna kapija LIGHT 
Pogledajte video prikaz projekta u Šimanovcima:
Ključne reči :
EUROFENCE 3D, panelna ograda RAL6005, zelena ograda, najprodavanija ograda, čelična ograda, pocinkovana ograda, plastificirana ograda, dvokrilna kapija LIGHT, panelna ispuna, ograda za dvorište, ograda za kuću, ograda za vikendicu, ograda Šimanovci, privatni posed, kapija sa ispunom, kompletna ograda sa kapijom.",IMG-1539.webp,IMG-1540.webp; IMG-1525-scaled.webp; IMG-1524-scaled.webp; IMG-1522-scaled.webp; IMG-1517-scaled.webp; IMG-1514-scaled.webp,6,https://www.youtube.com/watch?v=juh2Y_mi_M4,EUROFENCE 3D PANELNA OGRADA,Na privatnom posedu u Šimanovcima postavljena je EUROFENCE 3D panelna ograda u boji RAL6005 (zelena). Ova ograda je jedno od najtraženijih rešenja u našoj…,2026-06-11T15:54:21.035Z,2026-06-23T20:30:45.271Z,privatni 
867,EUROFENCE 3D PANELNA OGRADA,,eurofence-3d-panelna-ograda-3,published,2025-04-14T10:21:24.000Z,gotovi-projekti,"U okviru uređenja eksterijera tržnog centra SHOPPI u Beogradu, isporučena je i ugrađena visokokvalitetna EUROFENCE 3D panelna ograda u savremenoj RAL7016 antracit sivoj boji. Ovaj model ograde…",,"U okviru uređenja eksterijera tržnog centra SHOPPI u Beogradu, isporučena je i ugrađena visokokvalitetna EUROFENCE 3D panelna ograda u savremenoj RAL7016 antracit sivoj boji. Ovaj model ograde doprinosi modernom izgledu objekta i obezbeđuje pouzdanu zaštitu i dugotrajnost.
Karakteristike EUROFENCE 3D panelne ograde
- Materijal i struktura: Ograda je izrađena od čeličnih žica debljine 5 mm, što garantuje visoku čvrstoću i otpornost na udarce i spoljne uticaje. Profilisanje panela u 3D oblik dodatno povećava stabilnost i estetsku vrednost sistema.
- Stubovi i spojnice: Paneli su montirani na čelične stubove dimenzija 60×40 mm, a spojeni su pomoću INOX spojnica, koje omogućavaju elegantno i čvrsto povezivanje elemenata, uz dodatnu otpornost na koroziju.
- Boja i završna obrada: Svi elementi ograde plastificirani su u RAL7016 antracit sivoj boji, koja je postala standard u modernom urbanom pejzažu. Ova boja doprinosi ujednačenosti izgleda sa arhitekturom tržnog centra SHOPPI.
- Primena: EUROFENCE 3D ograda je idealna za komercijalne, javne i industrijske objekte, gde se zahteva visok nivo bezbednosti i vizuelne usklađenosti sa okruženjem.
Detaljnije informacije o EUROFENCE 3D ogradi dostupne su na sledećem linku:EUROFENCE 3D panelna ograda
Pogledajte video prezentaciju realizovanog projekta:
Ključne reči :panelna ograda, EUROFENCE 3D, ograda za tržni centar, antracit ograda, žičana ograda, RAL7016 ograda, ograda sa 5 mm žicom, INOX spojnice, stubovi 60×40, komercijalna ograda, bezbednosna ograda, dekorativna ograda, čelična panelna ograda, plastificirana ograda, ograda za poslovni objekat, SHOPPI Beograd ograda.",Eurofence-2d-panelna-ograda-3.webp,Eurofence-2d-panelna-ograda-5.webp; Eurofence-2d-panelna-ograda-4.webp; Eurofence-2d-panelna-ograda-2.webp; Eurofence-2d-panelna-ograda-1.webp,4,https://www.youtube.com/watch?v=50yQ7ZN71EU,EUROFENCE 3D PANELNA OGRADA,"U okviru uređenja eksterijera tržnog centra SHOPPI u Beogradu, isporučena je i ugrađena visokokvalitetna EUROFENCE 3D panelna ograda u savremenoj RAL7016…",2026-06-11T15:54:34.886Z,2026-06-23T20:30:35.743Z,poslovno-industrijski 
868,EUROFENCE 3D PANELNA OGRADA,,eurofence-3d-panelna-ograda-2,published,2025-04-14T10:03:26.000Z,gotovi-projekti,"Za potrebe ograđivanja poslovnog objekta kompanije Staklo Zorić u Staroj Pazovi, isporučena je i montirana kvalitetna panelna ograda tipa EUROFENCE 3D, u modernoj i elegantnoj RAL7016 antracit sivoj…",,"Za potrebe ograđivanja poslovnog objekta kompanije Staklo Zorić u Staroj Pazovi, isporučena je i montirana kvalitetna panelna ograda tipa EUROFENCE 3D, u modernoj i elegantnoj RAL7016 antracit sivoj boji.
Karakteristike EUROFENCE 3D panelne ograde
 Materijal i struktura: EUROFENCE 3D je izrađena od čeličnih žica debljine 4 mm, sa specijalnim 3D profilisanjem koje povećava čvrstoću i stabilnost panela. Ova konstrukcija obezbeđuje otpornost na mehaničke uticaje, habanje i vremenske uslove. 
 Završna obrada i boja: Svi paneli i stubovi su toplocinkovani i dodatno plastificirani za maksimalnu zaštitu i dug vek trajanja… Antracit siva boja RAL7016 savršeno se uklapa uz savremenu arhitekturu poslovno-industrijskih objekata. 
 Primenjivost: EUROFENCE 3D ograda predstavlja optimalno rešenje za firme, industrijske komplekse, poslovne zgrade i magacine kojima je potrebna sigurnost, preglednost i estetika u jednom proizvodu. 
Više informacija o EUROFENCE 3D ogradi možete pronaći na zvaničnoj stranici proizvoda:EUROFENCE 3D panelna ograda
Kapije LIGHT – Praktično rešenje uz panelnu ogradu
Uz panelnu ogradu, na objektu su postavljene pešačka kapija i samonosiva kapija modela LIGHT, koje su izrađene od čeličnih, toplo cinkovanih i plastificiranih profila, sa ispunom od istih EUROFENCE 3D panela.
 Usklađen dizajn: Kapije su dizajnirane tako da se potpuno estetski uklapaju uz panelnu ogradu, obezbeđujući uniformnost izgleda i funkcionalnosti. 
 Kvalitetna oprema: Kapije su opremljene dodatnom opremom renomiranog brenda LOCINOX, koji garantuje pouzdan rad, bezbednost i dugotrajnost. 
 Primenjivost: Model LIGHT je posebno pogodan za industrijske i komercijalne objekte, zbog jednostavne ugradnje, čvrstoće i kompatibilnosti sa sistemima kontrole pristupa. 
Detalji o kapijama LIGHT dostupni su ovde:Kapije LIGHT
Pogledajte video prezentaciju ograde i kapija na terenu:
Ključne reči :
panelna ograda, EUROFENCE 3D, antracit ograda, industrijska ograda, poslovni objekat ograda, ograda za firmu, žičana ograda, ograda sa panelima, LIGHT kapija, pešačka kapija, samonosiva kapija, kapija sa panelnom ispunom, RAL7016 ograda, čelična kapija, LOCINOX dodatna oprema, sigurnosna ograda, ogradni sistem, plastificirana ograda.",Eurofence-3d-panelna-ograda-3.webp,Eurofence-3d-panelna-ograda-2.webp; EUROFENCE-3d-panelna-ograda-1.webp; Eurofence-3d-panelna-ograda-4.webp,3,https://www.youtube.com/watch?v=4omvwx5jNgU,EUROFENCE 3D PANELNA OGRADA,"Za potrebe ograđivanja poslovnog objekta kompanije Staklo Zorić u Staroj Pazovi, isporučena je i montirana kvalitetna panelna ograda tipa EUROFENCE 3D…",2026-06-11T15:54:36.571Z,2026-06-23T20:30:34.395Z,poslovno-industrijski 
874,EUROFENCE 3D PANELNA OGRADA,,granicni-prelaz-kotroman-eurofence-3d-panelna-ograda,published,2025-03-10T12:47:38.000Z,gotovi-projekti,"U saradnji sa našim dugogodišnjim partnerima, uspešno smo realizovali projekat ograđivanja graničnog prelaza Kotroman, primenom EUROFENCE 3D panelne ograde i kapija LIGHT.",,"U saradnji sa našim dugogodišnjim partnerima, uspešno smo realizovali projekat ograđivanja graničnog prelaza Kotroman, primenom EUROFENCE 3D panelne ograde i kapija LIGHT.
Karakteristike postavljene ograde
 Tip ograde: Postavljena je EUROFENCE 3D panelna ograda koja se odlikuje čvrstoćom i dugotrajnošću. 
 Materijal: Paneli su izrađeni od čelične žice, sa horizontalnim pojačanjima koja obezbeđuju dodatnu stabilnost. 
 Boja i završna obrada: Ograda je plastificirana u RAL6005 (zelena boja), čime se postiže estetska usklađenost sa okruženjem, uz visoku otpornost na koroziju i spoljašnje uticaje. 
 Namena: Idealno rešenje za industrijske i infrastrukturne objekte, uključujući granične prelaze, gde je neophodna pouzdana i dugotrajna zaštita. 
🔗 Više informacija o EUROFENCE 3D ogradi možete pronaći ovde:EUROFENCE 3D Panelna Ograda
Kapije LIGHT – Pešačka i Dvokrilna Kapija
Uz panelnu ogradu postavljene su dve kapije LIGHT – jedna pešačka i jedna dvokrilna kapija.
 Materijal i izrada: Kapije su izrađene od toplocinkovanih čeličnih profila i plastificirane u RAL6005, sa ispunom od istog panela kao ograda, čime se postiže vizuelna harmonija. 
 Sigurnost i funkcionalnost: Obe kapije su opremljene LOCINOX šarkama i bravama, koje osiguravaju dugotrajan i pouzdan rad. 
 Primena: Pogodne za javne objekte, komercijalne i infrastrukturne prostore, gde su potrebna kvalitetna i trajna rešenja za kontrolu pristupa. 
🔗 Detalji o kapijama i opremi dostupni su na sledećim linkovima:Kapije LIGHTLOCINOX oprema
📽 Pogledajte video prezentaciju ovog projekta:
Ključne reči :
EUROFENCE 3D, panelna ograda, RAL6005, zelena ograda, čelična ograda, industrijska ograda, granični prelaz Kotroman, sigurnosna ograda, dvokrilna kapija, pešačka kapija, LIGHT kapija, LOCINOX brave, toplocinkovana kapija, panelna kapija, plastificirana ograda, dugotrajna zaštita.",EUROFENCE-3D-.webp,GRANICNI-PRELAZ-KOTROMAN-8.avif; GRANICNI-PRELAZ-KOTROMAN-7.avif; GRANICNI-PRELAZ-KOTROMAN-6.avif; GRANICNI-PRELAZ-KOTROMAN-4.avif; GRANICNI-PRELAZ-KOTROMAN-3.avif; GRANICNI-PRELAZ-KOTROMAN-2.avif; GRANICNI-PRELAZ-KOTROMAN-1.avif,7,https://www.youtube.com/watch?v=VFmD1GIlN_E,EUROFENCE 3D PANELNA OGRADA,"U saradnji sa našim dugogodišnjim partnerima, uspešno smo realizovali projekat ograđivanja graničnog prelaza Kotroman, primenom EUROFENCE 3D panelne ograde i…",2026-06-11T15:54:47.340Z,2026-06-23T20:30:26.087Z,poslovno-industrijski 
876,EUROFENCE 3D PANELNA OGRADA,,https-youtu-be-z8k1c61eqis-chatgpt-said-eurofence-3d-panelna-ograda-meita-loznica,published,2025-03-10T12:47:38.000Z,gotovi-projekti,"Za potrebe kompanije MEITA, postavljena je panelna ograda EUROFENCE 3D u plavoj boji RAL5010, čime je osigurana dugotrajna zaštita i estetski sklad sa okruženjem.",,"Za potrebe kompanije MEITA, postavljena je panelna ograda EUROFENCE 3D u plavoj boji RAL5010, čime je osigurana dugotrajna zaštita i estetski sklad sa okruženjem.
Karakteristike panelne ograde EUROFENCE 3D
 Materijal i konstrukcija: Ova ograda izrađena je od pocinčanih čeličnih žičanih panela, koji pružaju visoku otpornost na vremenske uslove i mehanička oštećenja. 
 Boja i završna obrada: Paneli su plastificirani u RAL5010 plavoj boji, koja osigurava dugotrajnu zaštitu od korozije i estetski moderan izgled. Ograda je dostupna u svim bojama iz RAL palete, a najpopularnije opcije su RAL7016 antracit siva, RAL6005 zelena i RAL9006 svetlo siva. 
 Primena: EUROFENCE 3D panelna ograda idealna je za ograđivanje industrijskih objekata, poslovnih prostora, stambenih kompleksa, škola i sportskih terena. Njena čvrstoća i funkcionalnost čine je pouzdanim rešenjem za različite tipove objekata. 
Više informacija o EUROFENCE 3D panelnoj ogradi dostupno je na zvaničnoj stranici proizvoda:EUROFENCE 3D panelna ograda
Pogledajte video prikaz postavljene panelne ograde u Loznici:
Ključne reči :
panelna ograda, EUROFENCE 3D, industrijska ograda, ograda za poslovne objekte, čelična ograda, RAL5010 plava ograda, RAL7016 antracit siva, RAL6005 zelena ograda, RAL9006 svetlo siva, zaštitna ograda, industrijska zaštita, ogradni paneli, pocinčana ograda, ograđivanje objekata, MEITA Loznica.",MEITA-LOZNICA-3-scaled.webp,MEITA-LOZNICA-1-2048x1536.avif; MEITA-LOZNICA-4-2048x1536.avif; MEITA-LOZNICA-2-2048x1536.avif,3,https://www.youtube.com/watch?v=z8k1C61EQIs,EUROFENCE 3D PANELNA OGRADA,"Za potrebe kompanije MEITA, postavljena je panelna ograda EUROFENCE 3D u plavoj boji RAL5010, čime je osigurana dugotrajna zaštita i estetski sklad sa…",2026-06-11T15:54:50.914Z,2026-06-23T20:30:23.394Z,poslovno-industrijski 
878,EUROFENCE 3D PANELNA OGRADA,,eurofence-3d-panelna-ograda-porsche-krnjaca-beograd,published,2025-03-10T12:47:38.000Z,gotovi-projekti,"Za potrebe auto-centra PORSCHE KRNJAČA u Beogradu, postavljena je EUROFENCE 3D panelna ograda u RAL7035 svetlosivoj boji. Ova ograda je odabrana zbog svoje neutralne estetike i visokog nivoa…",,"Za potrebe auto-centra PORSCHE KRNJAČA u Beogradu, postavljena je EUROFENCE 3D panelna ograda u RAL7035 svetlosivoj boji. Ova ograda je odabrana zbog svoje neutralne estetike i visokog nivoa sigurnosti.
Prednosti EUROFENCE 3D panelne ograde
 Estetska prilagodljivost: Svetlosiva boja RAL7035 omogućava neometan pogled na automobile, ističući izložene modele i doprinoseći modernom vizuelnom identitetu objekta. 
 Sigurnost i funkcionalnost: EUROFENCE 3D ograda sprečava preskakanje i provlačenje, čime se povećava bezbednost vozila i prostora. 
 Izdržljivost i dugotrajnost: Ograda je izrađena od pocinčanih čeličnih panela, koji su plastificirani radi dodatne otpornosti na koroziju i vremenske uticaje. 
 Primena: Pogodna je za auto-centre, industrijske objekte, poslovne prostore i komercijalne zone, gde je potrebno spojiti sigurnost i estetski sklad. 
Više informacija o EUROFENCE 3D panelnoj ogradi možete pronaći ovde:EUROFENCE 3D panelna ograda
Pogledajte video prezentaciju ograđenog auto-centra PORSCHE KRNJAČA:
Ključne reči :
EUROFENCE 3D, panelna ograda, svetlosiva ograda, RAL7035, auto-centar ograda, sigurnosna ograda, industrijska ograda, poslovna ograda, ograda za Porsche, čelična panelna ograda, protiv-provalna ograda, bezbednosna zaštita, neutralna estetika, dugotrajna ograda, auto salon zaštita.",PORSCHE-BEOGRAD-KRNJACA-5-scaled.webp,PORSCHE-BEOGRAD-KRNJACA-4-2048x1536.avif; PORSCHE-BEOGRAD-KRNJACA-3-2048x1536.avif; PORSCHE-BEOGRAD-KRNJACA-2-2048x1536.avif; PORSCHE-BEOGRAD-KRNJACA-1-2048x1536.avif,4,https://www.youtube.com/watch?v=c0tSppT46cg,EUROFENCE 3D PANELNA OGRADA,"Za potrebe auto-centra PORSCHE KRNJAČA u Beogradu, postavljena je EUROFENCE 3D panelna ograda u RAL7035 svetlosivoj boji. Ova ograda je odabrana zbog svoje…",2026-06-11T15:54:54.617Z,2026-06-23T20:30:20.684Z,poslovno-industrijski 
879,EUROFENCE 3D PANELNA OGRADA,,eurofence-3d-panelna-ograda-rezidencija-dedinje,published,2025-03-10T12:47:38.000Z,gotovi-projekti,"Za ograđivanje rezidencije na Dedinju, jednoj od najprestižnijih lokacija u Beogradu, korišćena je EUROFENCE 3D panelna ograda. Ovaj model ograde predstavlja idealno rešenje za stambene objekte,…",,"Za ograđivanje rezidencije na Dedinju, jednoj od najprestižnijih lokacija u Beogradu, korišćena je EUROFENCE 3D panelna ograda. Ovaj model ograde predstavlja idealno rešenje za stambene objekte, pružajući spoj sigurnosti, estetike i dugotrajnosti.
Prednosti EUROFENCE 3D panelne ograde
 Estetska prilagodljivost: EUROFENCE 3D dostupna je u različitim bojama iz RAL palete, što omogućava lako uklapanje u arhitektonski stil rezidencija i luksuznih vila. 
 Najpopularnije boje: RAL7016 antracit siva, RAL6005 zelena i RAL9006 svetlo siva, koje se najčešće biraju za ograđivanje stambenih i poslovnih objekata. 
 Sigurnost i dug vek trajanja: Paneli su izrađeni od pocinčanog čelika i dodatno plastificirani, što ih čini otpornim na koroziju, mehanička oštećenja i vremenske uslove. 
 Kombinacija sa kapijama: EUROFENCE 3D se odlično uklapa uz aluminijumske kapije, omogućavajući elegantno i moderno ograđivanje dvorišta i ulaza. 
 Primena: Namenjena je za luksuzne rezidencije, privatne vile, dvorišta, poslovne i komercijalne objekte, gde je neophodna kombinacija sigurnosti i estetskog izgleda. 
Više informacija o EUROFENCE 3D panelnoj ogradi dostupno je na sledećem linku:EUROFENCE 3D panelna ograda
Pogledajte video prezentaciju rezidencije na Dedinju ograđene ovom ogradom:
Ključne reči :
EUROFENCE 3D, panelna ograda, rezidencijalna ograda, ograda za vile, luksuzna ograda, RAL7016, RAL6005, RAL9006, antracit siva ograda, zelena ograda, svetlo siva ograda, pocinkovana ograda, plastificirana ograda, sigurnosna ograda, dvorišna ograda, moderna ograda, aluminijumske kapije, ograda za stambene objekte.",REZIDENCIJA-DEDINJE-2-scaled.webp,REZIDENCIJA-DEDINJE-7-2048x1536.avif; REZIDENCIJA-DEDINJE-6-2048x1536.avif; REZIDENCIJA-DEDINJE-5-2048x1536.avif; REZIDENCIJA-DEDINJE-4-2048x1536.avif; REZIDENCIJA-DEDINJE-3-2048x1536.avif; REZIDENCIJA-DEDINJE-1-2048x1536.avif,6,https://www.youtube.com/watch?v=yhnX6c6oGok,EUROFENCE 3D PANELNA OGRADA,"Za ograđivanje rezidencije na Dedinju, jednoj od najprestižnijih lokacija u Beogradu, korišćena je EUROFENCE 3D panelna ograda. Ovaj model ograde predstavlja…",2026-06-11T15:54:56.702Z,2026-06-23T20:30:19.328Z,privatni 
882,EUROFENCE 3D PANELNA OGRADA,,eurofence-3d-panelna-ograda-mei-ta-europe,published,2025-03-10T12:47:37.000Z,gotovi-projekti,"Za potrebe kompanije MEI TA EUROPE, uspešno smo ogradili njihov objekat u Bariču.",,"EUROFENCE 3D Panelna Ograda – Sigurnost i Dugotrajnost za MEI TA EUROPE
Za potrebe kompanije MEI TA EUROPE, uspešno smo ogradili njihov objekat u Bariču koristeći EUROFENCE 3D panelnu ogradu. Ova vrsta ograde predstavlja idealno rešenje za industrijske i komercijalne objekte, obezbeđujući visok nivo zaštite, dug vek trajanja i moderan izgled.
Prednosti EUROFENCE 3D panelne ograde
Izdržljivost i sigurnost: Ograda je izrađena od visokokvalitetnih pocinčanih i plastificiranih čeličnih panela, koji obezbeđuju dugotrajnu zaštitu od korozije i spoljašnjih uticaja.
RAL boja i estetika: Za objekat MEI TA EUROPE odabrana je RAL5015 (plava boja), koja doprinosi vizuelnoj prepoznatljivosti i skladnom uklapanju u industrijsko okruženje.
Dostupne boje: EUROFENCE 3D panelna ograda dostupna je u svim bojama iz RAL palete, a među najpopularnijim nijansama su:  RAL7016 – Antracit siva RAL6005 – Zelena RAL9006 – Svetlo siva  
Primena: Ova ograda je pogodna za industrijske komplekse, fabrike, poslovne objekte, sportske terene, škole i rezidencijalne prostore.
Jednostavna instalacija: Sistem EUROFENCE 3D panela omogućava brzu i laku montažu, uz minimalno održavanje tokom godina.
🔗 Pogledajte video projekta:
Ključne reči:
EUROFENCE 3D, panelna ograda, industrijska ograda, ograda za fabrike, sigurnosna ograda, pocinkovana ograda, plastificirana ograda, RAL5015, panelne ograde za objekte, dugotrajna ograda",EUROFENCE-3D-PANELNA-OGRADA-scaled.webp,WP-20161004-09-44-24-Rich-2048x1153.avif; WP-20161004-09-41-44-Rich-2048x1153.avif; WP-20161004-09-41-34-Rich-2048x1153.avif; WP-20161004-09-46-37-Rich-2048x1153.avif,4,https://www.youtube.com/watch?v=-IO4dm5XQgc,EUROFENCE 3D PANELNA OGRADA,"Za potrebe kompanije MEI TA EUROPE, uspešno smo ogradili njihov objekat u Bariču.",2026-06-11T15:55:02.525Z,2026-06-23T20:30:15.280Z,poslovno-industrijski 
810,EUROFENCE 3D PANELNA OGRADA HDG,,eurofence-3d-panelna-ograda-hdg,published,2026-02-20T12:27:02.000Z,gotovi-projekti,"Na privatnom objektu na Avali postavili smo EUROFENCE 3D panelnu ogradu debljine žice 5 mm, koja predstavlja pouzdano i dugotrajno rešenje za ograđivanje stambenih objekata, uz moderan i uredan…",,"Na privatnom objektu na Avali postavili smo EUROFENCE 3D panelnu ogradu debljine žice 5 mm, koja predstavlja pouzdano i dugotrajno rešenje za ograđivanje stambenih objekata, uz moderan i uredan izgled.
Karakteristike EUROFENCE 3D panelne ograde
 Zaštita i trajnost: Ograda je toplocinkovana, što je čini izuzetno izdržljivom i otpornom na vlagu, koroziju i sve vrste vremenskih uticaja. 
 Dodatna stabilnost: Paneli su postavljeni unutar čeličnih toplocinkovanih ramova, čime je značajno povećana mehanička otpornost i čvrstoća celokupnog sistema. 
 EUROFENCE 3D panelna ograda 
Način montaže
Stubovi su postavljeni usadno u betonsku podlogu, dok su čelični ramovi, na koje su pričvršćeni paneli, zavareni za stubove, čime je obezbeđena maksimalna stabilnost i dug vek trajanja kompletne konstrukcije. Ovakav način montaže garantuje čvrstinu sistema i sigurnost u svakodnevnoj upotrebi.
Video prezentacija montaže
Pogledajte kako izgleda EUROFENCE 3D panelna ograda na objektu na Avali:
Ključne reči za SEO:EUROFENCE 3D panelna ograda, toplocinkovana ograda, ograda debljine žice 5 mm, ograda sa čeličnim ramovima, usadni stubovi, zavareni ramovi, ograda za privatni objekat, ograda Avala, dugotrajna ograda, Palisada DOO.",eurofence3d20220725-191645222-iOS.webp,eurofence3d20220725-191645222-iOS.webp; eurofence3d20220725-191513235-iOS.webp; eurofence3d0-02-05-f0a294b4cbcfaf555dcefa883a73b7fe0dc0acc750d9ea47d01ff9fe4b9f2585-4d7ee084791ad2c9.webp; eurofence3d0-02-05-1fa0bf9acd3dcbb0975b63bfc0ff6a1a150d40070a451658fe552d120652760a-c2c3a39eb36ee458.webp,4,https://www.youtube.com/watch?v=UqWix2CWH4c,EUROFENCE 3D PANELNA OGRADA HDG,"Na privatnom objektu na Avali postavili smo EUROFENCE 3D panelnu ogradu debljine žice 5 mm, koja predstavlja pouzdano i dugotrajno rešenje za ograđivanje…",2026-06-11T15:51:17.098Z,2026-06-23T20:31:54.815Z,privatni 
866,EUROFENCE 3D PANELNA OGRADA I  KLIZNA KAPIJA LIGHT,,eurofence-3d-panelna-ograda-i-klizna-kapija-light,published,2025-04-22T12:05:16.000Z,gotovi-projekti,"Za potrebe ograđivanja objekta kompanije BI SI DOO postavljena je panelna ograda EUROFENCE 3D u RAL7016 antracit sivoj boji, kao i čelična klizna kapija LIGHT. Ovakvo rešenje obezbeđuje pouzdanu…",,"Za potrebe ograđivanja objekta kompanije BISI DOO postavljena je panelna ograda EUROFENCE 3D u RAL7016 antracit sivoj boji, kao i čelična klizna kapija LIGHT. Ovakvo rešenje obezbeđuje pouzdanu zaštitu i vizuelnu usklađenost sa savremenim poslovnim objektima.
Karakteristike panelne ograde EUROFENCE 3D
 Tip ograde: EUROFENCE 3D je panelna ograda sa trodimenzionalnim ojačanjima u obliku slova V, koja doprinosi dodatnoj čvrstoći i stabilnosti. 
 Dimenzije stubova: Na ovom objektu korišćeni su čelični stubovi dimenzija 60×40 mm, koji su ubetonirani u parapet radi maksimalne stabilnosti. 
 Boja i završna obrada: Ograda je plastificirana u RAL7016 antracit sivoj boji, koja je jedna od najpopularnijih opcija iz RAL palete. Paneli su dostupni i u drugim bojama, kao što su RAL6005 (zelena) i RAL9006 (svetlo siva). 
 Namena: EUROFENCE 3D je univerzalna ograda pogodna za ograđivanje komercijalnih, industrijskih i stambenih objekata. 
Dodatno, na ovom objektu je uz panelnu ogradu postavljena i klizna kapija LIGHT.
Karakteristike klizne kapije LIGHT
 Konstrukcija: Kapija je izrađena od toplo cinkovanih čeličnih profila, završno plastificiranih u RAL7016 boji, kako bi se u potpunosti uklopila sa panelnom ogradom. 
 Dizajn: Jednostavan i funkcionalan dizajn čini kapiju pogodnom za poslovne i industrijske objekte, gde je važna i estetika i pouzdanost. 
 Mogućnost automatizacije: Kapija LIGHT može se dodatno opremiti motornim pogonom iz naše ponude za potpunu automatizaciju i lakoću korišćenja. 
Više informacija o korišćenim proizvodima dostupno je na sledećim linkovima:Panelna ograda EUROFENCE 3DINOX spojnice za panelnu ograduKlizna kapija LIGHT
Pogledajte video prikaz sa objekta BISI DOO:
Ključne reči :panelna ograda, EUROFENCE 3D, čelična ograda, ograda RAL7016, klizna kapija LIGHT, industrijska ograda, stubovi 60×40, INOX spojnica, ograđivanje objekta, kapija sa motorom, plastificirana ograda, toplo cinkovana kapija, ograda za firmu, antracit siva ograda, moderna panelna ograda, EU kvalitet.",WP-20160817-14-23-38-Rich.webp,WP-20160817-14-25-06-Rich.webp; WP-20160817-14-25-03-Rich.webp; WP-20160817-14-24-23-Rich.webp; WP-20160817-14-24-18-Rich.webp; WP-20160817-14-23-57-Rich.webp,5,https://www.youtube.com/watch?v=5BhfXvGzW8o,EUROFENCE 3D PANELNA OGRADA I KLIZNA KAPIJA LIGHT,"Za potrebe ograđivanja objekta kompanije BI SI DOO postavljena je panelna ograda EUROFENCE 3D u RAL7016 antracit sivoj boji, kao i čelična klizna kapija LIGHT.",2026-06-11T15:54:32.945Z,2026-06-23T20:30:37.145Z,poslovno-industrijski 
