id,naslov_sr,naslov_en,slug,status,objavljeno,kategorije,excerpt_sr,excerpt_en,sadrzaj_sr,naslovna_slika,galerija_slike,broj_slika,video_url,meta_naslov_sr,meta_opis_sr,kreiran,azuriran,podkategorija
884,ALUMINIJUMSKA OGRADA ZA TERASU,,aluminijumska-ograda-za-terasu,published,2025-03-10T12:40:31.000Z,gotovi-projekti,"Za moderni izgled vaše terase, aluminijumske ograde su savršen izbor. Ove ograde ne samo da pružaju estetski privlačan dizajn, već su i izuzetno otporne na koroziju i sve vremenske uslove, što ih…",,"Za moderni izgled vaše terase, aluminijumske ograde su savršen izbor. Ove ograde ne samo da pružaju estetski privlačan dizajn, već su i izuzetno otporne na koroziju i sve vremenske uslove, što ih čini dugotrajnim i praktičnim rešenjem. Sa širokom paletom aluminijumskih profila i modela, moguće je prilagoditi ogradu prema vašim željama i potrebama.
Najtraženiji modeli ograda za terasu
•BELVEDERE – Polu-transparentna ograda sa profilima dimenzija 80×20 mm, koja omogućava delimičan pogled kroz ogradu, pružajući moderan izgled uz dobar stepen privatnosti. Ovaj model je idealan za sve koji žele da zadrže estetsku vrednost terase, uz moderan dizajn. Više o Belvedere ogradi.
•TIVOLI – Netransparentna ograda sa Z profilima koja pruža potpunu privatnost. Savršen izbor za one koji žele da obezbede intimnost na svojoj terasi, bez straha od pogleda sa strane. Više o Tivoli ogradi.
Sve aluminijumske ograde dolaze u širokoj paleti boja iz RAL sistema, čime je moguće uskladiti ogradu sa bojama i stilom vašeg objekta i okruženja.
Ove ograde su lakne za održavanje i dugotrajne, čineći ih odličnim rešenjem za terase svih tipova objekata.
Video prikaz proizvoda možete pogledati ovde:
Ključne reči: aluminijumska ograda za terasu, moderna ograda za terasu, polu-transparentna ograda, privatnost na terasi, RAL boje za ogradu, otpornost na koroziju, aluminijumski profili, Z profil ograda, dizajn po meri kupca, terasa sa ogradom, dugotrajnost.",OGRADA-ZA-TERASE-1.webp,OGRADA-ZA-TERASE-16.avif; OGRADA-ZA-TERASE-15-2048x1536.avif; OGRADA-ZA-TERASE-14-2048x1536.avif; OGRADA-ZA-TERASE-13.avif; OGRADA-ZA-TERASE-12-2048x1536.avif; OGRADA-ZA-TERASE-11-scaled.avif; OGRADA-ZA-TERASE-10.avif; OGRADA-ZA-TERASE-9-scaled.avif; OGRADA-ZA-TERASE-8-2048x1536.avif; OGRADA-ZA-TERASE-7-2048x1536.avif; OGRADA-ZA-TERASE-6-2048x1536.avif; OGRADA-ZA-TERASE-5.avif; OGRADA-ZA-TERASE-4-2048x1536.avif; OGRADA-ZA-TERASE-3-2048x1536.avif; OGRADA-ZA-TERASE-2-2048x1536.avif,15,https://www.youtube.com/watch?v=rPRBGBZszG8,ALUMINIJUMSKA OGRADA ZA TERASU,"Za moderni izgled vaše terase, aluminijumske ograde su savršen izbor. Ove ograde ne samo da pružaju estetski privlačan dizajn, već su i izuzetno otporne na…",2026-06-11T15:55:07.229Z,2026-06-23T20:30:12.559Z,privatni 
829,ALUMINIJUMSKA OGRADA ZA TERASU BELVEDERE,,aluminijumska-ograda-za-terasu-belvedere-3,published,2025-10-17T08:00:00.000Z,gotovi-projekti,"Na privatnom objektu u Beogradu, tim Palisada DOO postavio je aluminijumsku ogradu BELVEDERE, instaliranu na stepeništu i terasama objekta, čime je postignut savremen i vizuelno skladan izgled koji…",,"Na privatnom objektu u Beogradu, tim Palisada DOO postavio je aluminijumsku ogradu BELVEDERE, instaliranu na stepeništu i terasama objekta, čime je postignut savremen i vizuelno skladan izgled koji se uklapa u moderan arhitektonski koncept.
Karakteristike aluminijumske ograde BELVEDERE
 Dimenzije i konstrukcija: Ograda je izvedena u visini od 1,1 m, u skladu sa standardima za zaštitne ograde na terasama. Izrađena je od aluminijumskih profila dimenzija 80×20 mm, sa pažljivo odmerenim rastojanjem između lamela, što doprinosi delimično transparentnom i elegantnom izgledu. 
 Rukohvat: Na konstrukciju je dodat okrugli rukohvat fi 42 mm, koji obezbeđuje dodatnu stabilnost i pruža završni estetski pečat. 
 Završna obrada: Kompletna ograda je plastificirana u boji RAL7016 – antracit siva, koja pruža visoku otpornost na spoljne uticaje i dugotrajnu postojanost materijala. 
Više informacija o aluminijumskoj ogradi BELVEDERE možete pronaći ovde:👉 Aluminijumska ograda BELVEDERE
Video prezentacijaPogledajte video prikaz projekta ograde BELVEDERE na ovom objektu:
Ključne reči :aluminijumska ograda BELVEDERE, ograda za terasu, aluminijumska ograda na stepeništu, RAL7016 antracit siva, aluminijumski profili 80×20, moderni dizajn ograde, rukohvat fi42, zaštitna ograda, aluminijumska konstrukcija, Palisada DOO Beograd, dugotrajna aluminijumska ograda, savremena ograda za terasu.",ALUMINIJUMSKA-OGRADA-ZA-TERASE-1.webp,ALUMINIJUMSKA-OGRADA-ZA-TERASE-21.webp; ALUMINIJUMSKA-OGRADA-ZA-TERASE-7.webp; ALUMINIJUMSKA-OGRADA-ZA-TERASE-6.webp; ALUMINIJUMSKA-OGRADA-ZA-TERASE-5.webp; ALUMINIJUMSKA-OGRADA-ZA-TERASE-4.webp; ALUMINIJUMSKA-OGRADA-ZA-TERASE-3.webp; ALUMINIJUMSKA-OGRADA-ZA-TERASE-2.webp; ALUMINIJUMSKA-OGRADA-ZA-TERASE-1.webp; ALUMINIJUMSKA-OGRADA-ZA-TERASE-12.webp; ALUMINIJUMSKA-OGRADA-ZA-TERASE-11.webp; ALUMINIJUMSKA-OGRADA-ZA-TERASE-22.webp; ALUMINIJUMSKA-OGRADA-ZA-TERASE-23.webp,12,https://www.youtube.com/watch?v=0mQI4tzJgjg,ALUMINIJUMSKA OGRADA ZA TERASU BELVEDERE,"Na privatnom objektu u Beogradu, tim Palisada DOO postavio je aluminijumsku ogradu BELVEDERE, instaliranu na stepeništu i terasama objekta…",2026-06-11T15:52:56.189Z,2026-06-23T20:31:28.156Z,privatni 
836,ALUMINIJUMSKA OGRADA ZA TERASU BELVEDERE,,aluminijumska-ograda-za-terasu-belvedere-2,published,2025-09-29T11:05:03.000Z,gotovi-projekti,Na privatnom objektu u Beogradu izvršena je kompletna zamena stare drvene ograde modernim i dugotrajnim rešenjem – aluminijumskom ogradom BELVEDERE iz ponude Palisada DOO. Ovaj model ograde odlikuje…,,"Na privatnom objektu u Beogradu izvršena je kompletna zamena stare drvene ograde modernim i dugotrajnim rešenjem – aluminijumskom ogradom BELVEDERE iz ponude Palisada DOO. Ovaj model ograde odlikuje se savremenim izgledom, visokom funkcionalnošću i izdržljivošću, što ga čini jednim od najtraženijih rešenja za privatne posede.
Karakteristike aluminijumske ograde BELVEDERE
 Konstrukcija i materijal: Ograda je izrađena od aluminijumskih profila dimenzija 80×20 mm, koji obezbeđuju stabilnost i otpornost na spoljne uticaje. 
 Dizajn: Precizno definisano rastojanje između lamela daje ogradi polutransparentan izgled, čime se postiže balans između privatnosti i elegantnog vizuelnog identiteta dvorišta. 
 Montaža i završna obrada: Ogradni paneli montirani su na aluminijumske stubove, dok je dodatno ugrađen okrugli rukohvat koji doprinosi funkcionalnosti i zaokružuje celokupni estetski dojam. 
 Aluminijumska ograda BELVEDERE 
Prednosti aluminijumske ograde BELVEDERE
 Potpuna otpornost na vremenske uslove i koroziju zahvaljujući plastifikaciji. 
 Moderan i luksuzan izgled koji se lako uklapa uz različite arhitektonske stilove. 
 Dug vek trajanja i minimalno održavanje. 
Video prezentacijaPogledajte kako aluminijumska ograda BELVEDERE izgleda na ovom objektu u Beogradu:
Ključne reči :aluminijumska ograda BELVEDERE, RAL7016 antracit, aluminijumski profili 80×20, polutransparentna ograda, moderna ograda, privatni objekat Beograd, zamena drvene ograde, luksuzna aluminijumska ograda, plastificirana aluminijumska ograda, Palisada DOO.",Alu-ograda-za-terasu-5.webp,Alu-ograda-za-terasu-1.webp; Alu-ograda-za-terasu-5.webp; Alu-ograda-za-terasu-4.webp; Alu-ograda-za-terasu-3.webp; Alu-ograda-za-terasu-2.webp,5,https://www.youtube.com/watch?v=5OpY83YHSzM,ALUMINIJUMSKA OGRADA ZA TERASU BELVEDERE,Na privatnom objektu u Beogradu izvršena je kompletna zamena stare drvene ograde modernim i dugotrajnim rešenjem – aluminijumskom ogradom BELVEDERE iz ponude…,2026-06-11T15:53:15.689Z,2026-06-23T20:31:18.334Z,privatni 
903,ALUMINIJUMSKA OGRADA ZA TERASU BELVEDERE,,aluminijumska-ograda-za-terasu-belvedere,published,2025-03-10T11:59:34.000Z,gotovi-projekti,"Na privatnoj kući postavljena je aluminijumska ograda BELVEDERE na terasama, koja kombinuje vrhunsku funkcionalnost i moderan dizajn.",,"Na privatnoj kući postavljena je aluminijumska ograda BELVEDERE na terasama, koja kombinuje vrhunsku funkcionalnost i moderan dizajn.
Materijal i dizajnOgrada je izrađena od aluminijumskih profila dimenzija 80×20 mm, što pruža elegantan i minimalistički izgled. Ogradni paneli BELVEDERE postavljeni su na čelične stubove koji su toplocinkovani i plastificirani, čime se osigurava otpornost na koroziju i dug vek trajanja. Stubovi su precizno ankerisani za betonsku podlogu, pružajući stabilnost i sigurnost.
Rukohvat i završna obradaKako bi ograda bila potpuno funkcionalna i estetski dopadljiva, dodat je aluminijumski rukohvat koji upotpunjuje celokupni izgled. Ograda je plastificirana u RAL9005 crnu boju po želji klijenta, savršeno se uklapajući u moderne arhitektonske stilove.
Kvalitetna izrada i montažaSvi materijali su vrhunskog kvaliteta, a montaža je izvedena precizno i profesionalno, uz pridržavanje svih standarda. Naša BELVEDERE ograda idealna je za terase, balkone i dvorišne prostore, nudeći kombinaciju estetike, sigurnosti i trajnosti.
Zašto odabrati BELVEDERE ogradu?
Elegantan i moderan dizajn.
Izrađena od aluminijuma otpornog na vremenske uslove.
Garancija dugotrajnosti uz toplocinkovane i plastificirane stubove.
Potpuno prilagođavanje bojama iz RAL palete prema željama klijenata.
Više o ovom modelu pogledajte ovde:Aluminijumska ograda BELVEDERE
Ključne reči: aluminijumska ograda za terasu, BELVEDERE ograda, moderni dizajn terasa, RAL9005 crna ograda, plastificirana aluminijumska ograda, aluminijumski rukohvat, dugotrajne terasne ograde.",ALUMINIJUMSKA-OGRADA-ZA-TERASU-3-scaled.webp,ALUMINIJUMSKA-OGRADA-ZA-TERASU-4-2048x1536.avif; ALUMINIJUMSKA-OGRADA-ZA-TERASU-3-2048x1536.avif; ALUMINIJUMSKA-OGRADA-ZA-TERASU-2-2048x1536.avif; ALUMINIJUMSKA-OGRADA-ZA-TERASU-1-2048x1536.avif,4,https://www.youtube.com/watch?v=uAM6rG463uk,ALUMINIJUMSKA OGRADA ZA TERASU BELVEDERE,"Na privatnoj kući postavljena je aluminijumska ograda BELVEDERE na terasama, koja kombinuje vrhunsku funkcionalnost i moderan dizajn.",2026-06-11T15:55:43.362Z,2026-06-23T20:29:46.500Z,privatni 
883,ALUMINIJUMSKA OGRADA ZA TERASU I STEPENICE,,aluminijumska-ograda-za-terasu-i-stepenice,published,2025-03-10T12:47:37.000Z,gotovi-projekti,"Na privatnoj kući u Beogradu postavljena je aluminijumska ograda BELVEDERE, koja pruža moderan izgled i izuzetnu otpornost na spoljašnje uticaje.",,"Na privatnoj kući u Beogradu postavljena je aluminijumska ograda BELVEDERE, koja pruža moderan izgled i izuzetnu otpornost na spoljašnje uticaje.
Karakteristike aluminijumske ograde BELVEDERE
 Materijal i izrada: Ograda je izrađena od aluminijumskih profila dimenzija 80×20 mm, što garantuje dug vek trajanja i minimalno održavanje. 
 Montaža: Ogradni paneli su postavljeni na čelične toplocinkovane stubove, koji su dodatno plastificirani radi bolje zaštite od korozije i vremenskih uslova. 
 Fiksiranje: Stubovi su bočno ankerisani za betonsku podlogu, čime se postiže maksimalna stabilnost i čvrstoća cele konstrukcije. 
 Rukohvat: Kako bi ograda bila funkcionalnija i estetski privlačnija, dodat je okrugli aluminijumski rukohvat. 
 Završna obrada: Ograda je plastificirana u RAL7016 (antracit siva) boji, po želji klijenta, ali je dostupna u svim bojama iz RAL palete. 
Više informacija o aluminijumskoj ogradi BELVEDERE možete pronaći na sledećem linku:🔗 Aluminijumska ograda BELVEDERE
📽 Pogledajte video prezentaciju instalacije:
Ključne reči :
aluminijumska ograda, ograda za terasu, ograda za stepenište, BELVEDERE ograda, aluminijumski profili, antracit siva ograda, RAL7016, čelični stubovi, otpornost na koroziju, moderna ograda, dugotrajna ograda, plastificirana ograda, dvorišna ograda, sigurnosna ograda, dekorativna ograda.",ALUMINIJUMSKA-OGRADA-ZA-TERASU-I-STEPENICE-scaled.webp,IMG-0994-1-2048x1536.avif; IMG-0995-1-2048x1536.avif; IMG-0997-1-2048x1536.avif; IMG-0998-1-2048x1536.avif; IMG-0999-1-2048x1536.avif; IMG-1001-1-2048x1536.avif; IMG-1002-1-2048x1536.avif,7,https://www.youtube.com/watch?v=_zrGPti0J6E,ALUMINIJUMSKA OGRADA ZA TERASU I STEPENICE,"Na privatnoj kući u Beogradu postavljena je aluminijumska ograda BELVEDERE, koja pruža moderan izgled i izuzetnu otpornost na spoljašnje uticaje.",2026-06-11T15:55:04.673Z,2026-06-23T20:30:13.915Z,privatni 
899,ALUMINIJUMSKA SAMONOSIVA KAPIJA PRO,,aluminijumska-samonosiva-kapija-pro,published,2025-03-10T12:12:02.000Z,gotovi-projekti,"S ponosom Vam predstavljamo uspešan početak saradnje sa firmom HOLLER TORE iz Austrije. U industrijskoj zoni u Batajnici postavljena je prva HOLLER SLIDING PRO KAPIJA, inovativno rešenje koje donosi…",,"S ponosom Vam predstavljamo uspešan početak saradnje sa firmom HOLLER TORE iz Austrije. U industrijskoj zoni u Batajnici postavljena je prva HOLLER SLIDING PRO KAPIJA, inovativno rešenje koje donosi najnovije tehnologije u svetu kapija.
Aluminijumska PRO kapija je kompletno izrađena od aluminijumskih profila, a varovi su urađeni laserski, jedinstvenim robotom koji omogućava gotovo neprimetne spojeve. Ovaj visokotehnološki proces garantuje dugotrajnost, preciznost i estetski savršenstvo. PRO kapija je izuzetno lagana, što omogućava lako otvaranje i zatvaranje kapije jednom rukom, bez napora, dok se istovremeno očuvava njena čvrstina i stabilnost.
Aluminijumska samonosiva kapija PRO može biti automatizovana motorom KINGGATES, iz naše redovne ponude, ili motorom HOLLER, u zavisnosti od vaših specifičnih potreba. Automatizacija omogućava dodatnu udobnost i sigurnost, idealno rešenje za komercijalne i industrijske prostore.
Kapija je dostupna u impresivnim dimenzijama, sa maksimalnom širinom do 50 m i maksimalnom visinom do 6 m, što je čini savršenim rešenjem za široke industrijske ili poslovne objekte. Samonosive aluminijumske PRO klizne kapije kombinuju najnovije tehnologije i materijale, što im obezbeđuje izdržljivost, funkcionalnost i najviše standarde kvaliteta.
Uz širok spektar kreativnih i inovativnih opcija dizajna, ove klizne kapije će estetski unaprediti svaki prostor, bez obzira na okolinu. Sve klizne kapije su prethodno montirane i testirane u fabrici pre otpreme, što garantuje visok nivo kvaliteta i preciznosti.
Za više informacija o aluminijumskim samonosivim kapijama PRO i njihovoj automatizaciji, posetite našu ponudu:
Automatizacija kapija
SEO ključne reči: „aluminijumska samonosiva kapija PRO“, „HOLLER SLIDING PRO KAPIJA“, „automatizovane kapije“, „klizna kapija“, „aluminijumske kapije sa motorom“, „samonosive kapije“, „industrijske kapije“, „klizne kapije za industrijske objekte“, „kapija sa maksimalnom širinom 50m“, „KINGGATES motor“.",ALUMINIJUMSKA-SAMONOSIVA-KAPIJA-STANDARD-PRO-3-scaled.webp,ALUMINIJUMSKA-SAMONOSIVA-KAPIJA-STANDARD-PRO-6-2048x1536.avif; ALUMINIJUMSKA-SAMONOSIVA-KAPIJA-STANDARD-PRO-5-2048x1536.avif; ALUMINIJUMSKA-SAMONOSIVA-KAPIJA-STANDARD-PRO-4-2048x1536.avif; ALUMINIJUMSKA-SAMONOSIVA-KAPIJA-STANDARD-PRO-3-2048x1536.avif; ALUMINIJUMSKA-SAMONOSIVA-KAPIJA-STANDARD-PRO-2-2048x1536.avif; ALUMINIJUMSKA-SAMONOSIVA-KAPIJA-STANDARD-PRO-1-2048x1536.avif,6,https://www.youtube.com/watch?v=j7slLfDRgLs,ALUMINIJUMSKA SAMONOSIVA KAPIJA PRO,S ponosom Vam predstavljamo uspešan početak saradnje sa firmom HOLLER TORE iz Austrije. U industrijskoj zoni u Batajnici postavljena je prva HOLLER SLIDING PRO…,2026-06-11T15:55:36.120Z,2026-06-23T20:29:52.009Z,poslovno-industrijski 
898,AUTOMATSKA PUTNA RAMPA KING GATES OPEN4000,,automatska-putna-rampa-king-gates-open4000,published,2025-03-10T12:23:43.000Z,gotovi-projekti,"Automatska putna rampa KING GATES OPEN4000 namenjena je kontroli pristupa i ograničavanju prolaza vozila, obezbeđujući efikasan i siguran rad u različitim okruženjima. Svi glavni delovi nalaze se u…",,"Automatska putna rampa KING GATES OPEN4000 namenjena je kontroli pristupa i ograničavanju prolaza vozila, obezbeđujući efikasan i siguran rad u različitim okruženjima. Svi glavni delovi nalaze se u kućištu rampe, izrađenom od pocinkovanog čelika i plastificiranom kako bi se postigla maksimalna otpornost na koroziju. Pokretni deo rampe – “ruka” – izrađen je od aluminijuma, obezbeđujući lagan i stabilan rad, kao i dugotrajnu izdržljivost.
Zahvaljujući savremenoj tehnologiji, rampa funkcioniše u svim vremenskim uslovima. Po potrebi, može biti opremljena baterijom koja omogućava privremeno napajanje u slučaju nestanka električne energije, čime se održava kontinuirana kontrola pristupa.
Dostupna su dva seta automatskih rampi KING GATES OPEN serije:
•OPEN4000: Dužina ruke do 4 m, vreme otvaranja 3,5 sekunde
•OPEN6000: Dužina ruke do 6 m, vreme otvaranja 5 sekundi
Standardni SET sadrži
•Rampu
•Signalnu lampu
•Jedan par foto-ćelija
•Dva daljinska upravljača
Moguća je ugradnja dodatne opreme, kao što su mobilni ili fiksni nogar za pokretni deo rampe, zavesica, LED osvetljenje i slično. Takođe, rampa se može povezati sa različitim sistemima za kontrolu pristupa, uključujući induktivne petlje, čitače kartica i kamere za prepoznavanje registarskih tablica, čime se postiže viši nivo automatizacije i sigurnosti.
Pogledajte i video na:
SEO ključne reči: “automatska putna rampa”, “KING GATES OPEN4000”, “kontrola pristupa vozila”, “pocinkovan čelik i plastifikacija”, “baterijsko napajanje rampe”, “induktivna petlja”, “čitač kartica”, “kamera za prepoznavanje tablica”, “LED osvetljenje rampe”",ELEKTRO-RAMPA-OPEN-4000-KING-GATES-1.webp,ELEKTRO-RAMPA-OPEN-4000-KING-GATES-7.avif; ELEKTRO-RAMPA-OPEN-4000-KING-GATES-6.avif; ELEKTRO-RAMPA-OPEN-4000-KING-GATES-5.avif; ELEKTRO-RAMPA-OPEN-4000-KING-GATES-4.avif; ELEKTRO-RAMPA-OPEN-4000-KING-GATES-3.avif; ELEKTRO-RAMPA-OPEN-4000-KING-GATES-2.avif,6,https://www.youtube.com/watch?v=DhR9-i3y0uY,AUTOMATSKA PUTNA RAMPA KING GATES OPEN4000,"Automatska putna rampa KING GATES OPEN4000 namenjena je kontroli pristupa i ograničavanju prolaza vozila, obezbeđujući efikasan i siguran rad u različitim…",2026-06-11T15:55:34.419Z,2026-06-23T20:29:53.393Z,privatni 
900,AUTOMATSKA PUTNA RAMPA KING GATES OPEN6000,,automatska-putna-rampa,published,2025-03-10T12:12:02.000Z,gotovi-projekti,"Automatska putna rampa KING GATES OPEN6000 dizajnirana je za kontrolu pristupa i ograničavanje prolaza vozila, pružajući sigurnost i efikasnost u različitim okruženjima, od poslovnih objekata do…",,"Automatska putna rampa KING GATES OPEN6000 dizajnirana je za kontrolu pristupa i ograničavanje prolaza vozila, pružajući sigurnost i efikasnost u različitim okruženjima, od poslovnih objekata do industrijskih zona. Zahvaljujući vrhunskoj tehnologiji i kvalitetnim materijalima, rampa pruža pouzdan rad u svim vremenskim uslovima.
Glavni delovi rampe nalaze se u kućištu izrađenom od pocinkovanog i plastificiranog čelika, što obezbeđuje dugotrajnost i otpornost na koroziju. Pokretni deo rampe, tzv. „ruka“, izrađen je od aluminijuma, čime se osigurava optimalna čvrstina i laka manipulacija.
Ključne karakteristike rampe KING GATES
OPEN4000: Dužina ruke do 4 m, vreme otvaranja 3,5 sekunde.
OPEN6000: Dužina ruke do 6 m, vreme otvaranja 5 sekundi.
Za dodatnu sigurnost i funkcionalnost, rampa može biti opremljena baterijom za privremeno napajanje u slučaju nestanka električne energije.
Sadržaj standardnog seta
Automatska putna rampa.
Signalna lampa.
Jedan par foto-ćelija.
Dva daljinska upravljača.
Dodatne opcije opreme
Mobilni ili fiksni nogar za pokretni deo rampe.
Zavesica za dodatnu zaštitu.
LED osvetljenje za bolje vizuelno obeležavanje rampe.
Povezivanje sa sistemima za kontrolu pristupa, uključujući induktivne petlje, čitače kartica, kamere za prepoznavanje registarskih tablica i druge uređaje.
Ova moderna rampa idealna je za sve vrste aplikacija gde je potrebna kontrola ulaza i izlaza vozila, a njena jednostavna montaža i visok nivo funkcionalnosti čine je jednim od najboljih rešenja na tržištu.
Za detalje o ugradnji i radu automatske rampe KING GATES OPEN6000, pogledajte video:
SEO ključne reči: „automatska putna rampa KING GATES“, „rampa za kontrolu pristupa“, „KING GATES OPEN6000“, „automatska rampa OPEN4000“, „rampa sa LED osvetljenjem“, „rampa sa čitačem kartica“, „rampa za industrijske objekte“, „kontrola prolaza vozila“, „pocinkovana rampa“, „rampa sa aluminijumskom rukom“.",ELEKTRO-RAMPA-OPEN-6000-KING-GATES-9.webp,ELEKTRO-RAMPA-OPEN-6000-KING-GATES-4.avif; ELEKTRO-RAMPA-OPEN-6000-KING-GATES-3-2048x1152.avif; ELEKTRO-RAMPA-OPEN-6000-KING-GATES-2.avif; ELEKTRO-RAMPA-OPEN-6000-KING-GATES-1.avif; ELEKTRO-RAMPA-OPEN-6000-KING-GATES-9.avif; ELEKTRO-RAMPA-OPEN-6000-KING-GATES-8.avif; ELEKTRO-RAMPA-OPEN-6000-KING-GATES-7.avif; ELEKTRO-RAMPA-OPEN-6000-KING-GATES-6.avif; ELEKTRO-RAMPA-OPEN-6000-KING-GATES-5.avif,9,https://www.youtube.com/watch?v=tdxgtEnKa2w,AUTOMATSKA PUTNA RAMPA KING GATES OPEN6000,"Automatska putna rampa KING GATES OPEN6000 dizajnirana je za kontrolu pristupa i ograničavanje prolaza vozila, pružajući sigurnost i efikasnost u različitim…",2026-06-11T15:55:38.141Z,2026-06-23T20:29:50.603Z,poslovno-industrijski 
917,Aluminijumska (ALU) ograda Tivoli,,aluminijumska-alu-ograda-tivoli,published,2025-03-10T09:28:48.000Z,gotovi-projekti,TIVOLI aluminijumska ograda je jedna od najtrazenijih i najboljih aluminijumskih ograda koje skrivaju unutrasnjost od nepozeljnih pogleda s vana. Od ovih aluminijumskih profila se mogu praviti i sve…,,"Aluminijumska ograda TIVOLI sa tzv. “Z” profilima
TIVOLI aluminijumska ograda je jedna od najtraženijih i najboljih aluminijumskih ograda, koje skrivaju unutrašnjost od nepoželjnih pogleda spolja. Od ovih aluminijumskih profila mogu se praviti i sve vrste aluminijumskih kapija.
Aluminijumske kapije mogu biti motorizovane našim motorima iz Italije, serije Dynamos 400/1000/1500/2500 kg, sve u zavisnosti od težine i veličine aluminijumskih kapija.
Garancija za motore je 30 meseci, dok je garancija na aluminijum 20 godina. Uz naše aluminijumske ograde nudimo kompletnu uslugu isporuke i montaže na celoj teritoriji Srbije i šire.
Takođe, izvodimo i sve potrebne betonske radove.",IMG-8532-scaled.webp,Aluminijumska-ograda-Tivoli-08-scaled.webp; Aluminijumska-ograda-Tivoli-07-scaled.webp; Aluminijumska-ograda-Tivoli-03-scaled.webp; Aluminijumska-ograda-Tivoli-01-scaled.webp; Aluminijumska-ograda-Tivoli-06-scaled-e1727166855274.webp; Aluminijumska-ograda-Tivoli-05-scaled-e1727166876782.webp; Aluminijumska-ograda-Tivoli-04-scaled-e1727166899711.webp; Aluminijumska-ograda-Tivoli-02-scaled-e1727166919538.webp,8,https://www.youtube.com/watch?v=t2PLD0_UNN8,Aluminijumska (ALU) ograda Tivoli,TIVOLI aluminijumska ograda je jedna od najtrazenijih i najboljih aluminijumskih ograda koje skrivaju unutrasnjost od nepozeljnih pogleda s vana.,2026-06-11T15:56:10.107Z,2026-06-23T20:29:27.334Z,privatni 
918,Aluminijumska (Alu) ograda Belvedere,,aluminijumska-alu-ograda-belvedere,published,2025-03-10T09:01:41.000Z,gotovi-projekti,Aluminijumska (Alu) ograda Belvedere– Beograd Aluminijumska (Alu) ograda Bevedere sa profilima 80×20 https://palisada.rs/proizvodi/decor/ Belvedere aluminijumska (Alu) ograda je jedna od…,,"Aluminijumska (Alu) ograda Belvedere– Beograd
Aluminijumska (Alu) ograda Bevedere sa profilima 80×20
Belvedere aluminijumska (Alu) ograda je jedna od najtraženijih i najboljih aluminijumskih ograda. Od ovih aluminijumskih profila se mogu praviti i sve vrste aluminijumskih kapija.
Za pešačke kaije koristimo Locinox opremu, Garancije za aluminijumske (Alu) ograde je 30 godina.
Uz naše aluminijumske ograde nudimo i komplet uslugu isporuke i montaze na celoj teritoriji Srbije i šire. 
Izvodimo i sve betonske radove koji su potrebni.",Aluminijumska-ograda-Belvedere-01-scaled.webp,Aluminijumska-ograda-Belvedere-07-scaled-e1727186271698.webp; Aluminijumska-ograda-Belvedere-06-scaled-e1727186283234.webp; Aluminijumska-ograda-Belvedere-05-scaled-e1727186315378.webp; Aluminijumska-ograda-Belvedere-04-scaled-e1727186332157.webp,4,,Aluminijumska (Alu) ograda Belvedere,Belvedere aluminijumska (Alu) ograda je jedna od najtraženijih i najboljih aluminijumskih ograda.,2026-06-11T15:56:11.698Z,2026-06-23T20:29:25.999Z,nema linka 
