id,naslov_sr,naslov_en,slug,status,objavljeno,kategorije,excerpt_sr,excerpt_en,sadrzaj_sr,naslovna_slika,galerija_slike,broj_slika,video_url,meta_naslov_sr,meta_opis_sr,kreiran,azuriran,podkategorija
906,EUROFENCE 3D Panelna Ograda – Ripanj,,eurofence-3d-panelna-ograda-ripanj,published,2025-03-10T11:32:58.000Z,gotovi-projekti,"Za potrebe ogradivanja vikendice u Ripnju, postavili smo EUROFENCE 3D panelnu ogradu u zelenoj boji RAL6005, koja se pokazala kao idealno rešenje za objekte okružene prirodom. Zelena boja savršeno se…",,"Za potrebe ogradivanja vikendice u Ripnju, postavili smo EUROFENCE 3D panelnu ogradu u zelenoj boji RAL6005, koja se pokazala kao idealno rešenje za objekte okružene prirodom. Zelena boja savršeno se uklapa sa okruženjem, pružajući ne samo sigurnost, već i estetski prijatan izgled.
EUROFENCE 3D u boji RAL6005 je naša najtraženija i najprodavanija ograda, zahvaljujući svojoj čvrstini, otpornosti na vremenske uslove i dugotrajnosti. Ova panelna ograda je savršeno rešenje za ograđivanje vikendica, kuća sa dvorištem ili bilo kojih drugih objekata smeštenih u prirodnom okruženju.
Uz ovu ogradu, na istom objektu postavili smo i dvokrilnu kapiju LIGHT, koja je izrađena od čeličnih toplocinkovanih i plastificiranih profila. Ispuna kapije je od panelnog materijala kako bi se vizuelno i funkcionalno uklopila sa EUROFENCE 3D ogradom, pružajući kohezivan izgled i dodatnu sigurnost za objekat.
Naša usluga uključuje kompletnu isporuku i montažu na celoj teritoriji Srbije, zajedno sa svim potrebnim betonskim radovima za instalaciju kapija i ograda.",3D-PANELNA-OGRADA-2-2-scaled.webp,3D-PANELNA-OGRADA-4-2-2048x1536.avif; 3D-PANELNA-OGRADA-3-2-2048x1536.avif; 3D-PANELNA-OGRADA-2-2-2048x1536.avif; 3D-PANELNA-OGRADA-1-2-2048x1536.avif,4,https://www.youtube.com/watch?v=hR8-eQw3Z_Q,EUROFENCE 3D Panelna Ograda - Ripanj,"Za potrebe ogradivanja vikendice u Ripnju, postavili smo EUROFENCE 3D panelnu ogradu u zelenoj boji RAL6005, koja se pokazala kao idealno rešenje za objekte…",2026-06-11T15:55:48.919Z,2026-06-23T20:29:42.372Z,privatni 
877,KAPIJA STANDARD,,metalfer-steel-mill-sremska-mitrovica,published,2025-03-10T12:47:38.000Z,gotovi-projekti,"Za potrebe novog objekta firme METALFER STEEL MILL, izvršeno je kompletno ograđivanje uz upotrebu samonosivih kapija, dvokrilnih i pešačkih kapija, kao i EUROFENCE 3D panelne ograde.",,"Za potrebe novog objekta firme METALFER STEEL MILL, izvršeno je kompletno ograđivanje uz upotrebu samonosivih kapija, dvokrilnih i pešačkih kapija, kao i EUROFENCE 3D panelne ograde.
Samonosive kapije STANDARD
 Model: Samonosive kapije STANDARD sa ispunom od kutijastih profila. 
 Materijal i završna obrada: Profili su toplocinkovani i plastificirani u RAL3020 crvenoj boji, čime se osigurava dugotrajna zaštita i vizuelna usklađenost sa objektom. 
 Oprema: Za ove kapije korišćena je HI MOTIONS ITALY oprema, poznata po vrhunskom kvalitetu i pouzdanosti. 
Detalji o samonosivim kapijama STANDARD dostupni su ovde:Samonosiva kapija STANDARDHI MOTIONS oprema
Dvokrilna i pešačka kapija STANDARD
 Model: Dvokrilna i pešačka kapija STANDARD izrađene u RAL3020 crvenoj boji. 
 Oprema: LOCINOX šarke i brave omogućavaju dug vek trajanja i sigurnost prilikom korišćenja. 
Više informacija o dvokrilnoj i pešačkoj kapiji STANDARD:Dvokrilna kapija STANDARD
EUROFENCE 3D panelna ograda
 Boja: Paneli su plastificirani u RAL7035 svetlosivoj boji, dok su stubovi u RAL3020 crvenoj boji, što doprinosi modernom i prepoznatljivom vizuelnom identitetu objekta. 
 Materijal: Ograda je izrađena od pocinčanih čeličnih panela, koji osiguravaju otpornost na spoljašnje uslove i mehaničke uticaje. 
Detalji o EUROFENCE 3D panelnoj ogradi dostupni su na sledećem linku:EUROFENCE 3D panelna ograda
Jednokrilne kapije LIGHT unutar objekta
 Model: Kapije LIGHT sa povratnim mehanizmom VERTICLOSE 2 LOCINOX i anti-panic sistemom, čime se obezbeđuje funkcionalnost i sigurnost. 
Detalji o jednokrilnim kapijama LIGHT dostupni su ovde:Kapije LIGHT
Pogledajte video prikaz ograđivanja objekta METALFER STEEL MILL:
Ključne reči :
samonosiva kapija, dvokrilna kapija, pešačka kapija, kapija STANDARD, EUROFENCE 3D, industrijska ograda, panelna ograda, HI MOTIONS oprema, LOCINOX šarke i brave, VERTICLOSE 2, anti-panic sistem, kapija LIGHT, METALFER STEEL MILL, RAL3020 crvena kapija, RAL7035 svetlosiva ograda, industrijska zaštita, sigurnosna kapija, toplocinkovana kapija.",METALFER-S.MITROVICA-2-1.webp,METALFER-S.MITROVICA-6.webp; METALFER-S.MITROVICA-5.webp; METALFER-S.MITROVICA-4.webp; METALFER-S.MITROVICA-3.webp; METALFER-S.MITROVICA-1.webp; METALFER-S.MITROVICA-7.webp,6,https://www.youtube.com/watch?v=rSKDu6jr2d4,KAPIJA STANDARD,"Za potrebe novog objekta firme METALFER STEEL MILL, izvršeno je kompletno ograđivanje uz upotrebu samonosivih kapija, dvokrilnih i pešačkih kapija…",2026-06-11T15:54:52.814Z,2026-06-23T20:30:22.045Z,poslovno-industrijski 
815,KING GATES RAMPA OPEN 4000,,king-gates-rampa-open-4000,published,2025-12-23T14:42:04.000Z,gotovi-projekti,"Na privatnoj stambenoj zgradi u Beogradu, tim Palisada DOO instalirao je automatsku putnu rampu KING GATES OPEN 4000, sa ciljem obezbeđivanja privatnog parking prostora i potpune kontrole pristupa…",,"Na privatnoj stambenoj zgradi u Beogradu instalirana je automatska putna rampa KING GATES OPEN 4000, sa ciljem obezbeđivanja privatnog parking prostora i kontrolisanog pristupa objektu. Ovo rešenje omogućava jednostavno upravljanje ulazom i izlazom vozila, uz visok nivo bezbednosti i pouzdanosti u svakodnevnoj upotrebi.
Karakteristike automatske rampe KING GATES OPEN 4000
 Namena: Automatska putna rampa OPEN 4000 namenjena je efikasnoj kontroli pristupa i ograničavanju prolaza vozila na privatnim, stambenim i poslovnim objektima. 
 Konstrukcija: Glavni mehanizmi rampe smešteni su u čelično kućište, dodatno zaštićeno završnom obradom, dok je ruka rampe izrađena od aluminijuma, što garantuje dug vek trajanja i otpornost na spoljne uticaje. 
 Pouzdan rad: Zahvaljujući savremenoj tehnologiji i kvalitetnoj izradi, rampa obezbeđuje stabilan i siguran rad u svim vremenskim uslovima. 
Više informacija o proizvodu:Automatska putna rampa KING GATES OPEN 4000
Dodatne funkcionalnosti i mogućnosti proširenja
 mogućnost ugradnje baterije za rad u slučaju nestanka električne energije 
 otvaranje pomoću daljinskog upravljača, kartica ili parking sistema 
 kompatibilnost sa dodatnom opremom kao što su mobilni ili fiksni nogar, zavesica i LED osvetljenje 
 mogućnost povezivanja sa sistemima kontrole pristupa, uključujući indukcione petlje, čitače kartica i LPR kamere 
Video prezentacija montaže
Pogledajte video prikaz instalirane automatske rampe KING GATES OPEN 4000 na objektu:
Ključne reči :automatska putna rampa, KING GATES OPEN 4000, rampa za privatni parking, kontrola pristupa vozilima, automatska rampa Beograd, parking rampa, aluminijumska ruka rampe, čelično kućište rampe, sistemi kontrole pristupa, Palisada DOO.",KING-GATES-RAMPA-OPEN4000.webp,KING-GATES-OPEN4000.webp; KING-GATES-RAMPA-OPEN4000.webp,2,https://www.youtube.com/watch?v=mwgqmRy5qd4,KING GATES RAMPA OPEN 4000,"Na privatnoj stambenoj zgradi u Beogradu, tim Palisada DOO instalirao je automatsku putnu rampu KING GATES OPEN 4000, sa ciljem obezbeđivanja privatnog parking…",2026-06-11T15:51:39.765Z,2026-06-23T20:31:47.956Z,privatni 
828,KLIZNA KAPIJA LIGHT,,klizna-kapija-light,published,2025-10-17T08:00:00.000Z,gotovi-projekti,"Na privatnom objektu u okolini Beograda, tim Palisada DOO postavio je kliznu kapiju LIGHT, izrađenu od čeličnih toplocinkovanih profila, dodatno zaštićenih plastifikacijom u boji RAL6005 – zelena…",,"Klizna kapija LIGHT – Privatni objekat, okolina Beograda
Na privatnom objektu u okolini Beograda, tim Palisada DOO postavio je kliznu kapiju LIGHT, izrađenu od čeličnih toplocinkovanih profila, dodatno zaštićenih plastifikacijom u boji RAL6005 – zelena mahovina. Ova kapija kombinuje moderan izgled, trajnost i jednostavno održavanje, što je čini idealnim rešenjem za stambene i poslovne objekte.
Karakteristike klizne kapije LIGHT
 Izrada: Konstrukcija je izrađena od toplocinkovanih čeličnih profila, koji obezbeđuju otpornost na koroziju i spoljne uticaje. 
 Ispuna: Kapija je ispunjena 3D panelima, koji doprinose stabilnosti i estetskom skladu kompletnog sistema. 
 Završna obrada: Plastifikacija u nijansi RAL6005 – zelena mahovina, pruža kapiji prirodan izgled i dodatnu zaštitu od vremenskih uslova. 
 Klizna kapija LIGHT 
Automatizacija kapije
 Pogon: Kapija je u potpunosti automatizovana motorom KING GATES DYNAMOS 400, koji je namenjen za klizne i samonosive kapije do 400 kg. 
 Prednosti: Motor se odlikuje tihim radom, pouzdanošću i dugim vekom trajanja, što obezbeđuje bezbedan i komforan rad sistema. 
 Motorni pogon KING GATES DYNAMOS 400 
Video prezentacijaPogledajte video prikaz klizne kapije LIGHT na ovom objektu:
Ključne reči:klizna kapija LIGHT, RAL6005 zelena mahovina, čelična kapija, plastificirana kapija, 3D panel ispuna, automatizovana kapija, KING GATES DYNAMOS 400, motor za klizne kapije, Palisada DOO, čelična konstrukcija, dugotrajna kapija, kapija za privatni objekat, industrijska kapija, samonosiva kapija.",KLIZNA-KAPIJA-LIGHT-2.webp,KLIZNA-KAPIJA-LIGHT-5.webp; KLIZNA-KAPIJA-LIGHT-4.webp; KLIZNA-KAPIJA-LIGHT-3.webp; KLIZNA-KAPIJA-LIGHT-2.webp; KLIZNA-KAPIJA-LIGHT-1.webp,5,https://www.youtube.com/watch?v=p6rvQVpv6BE,KLIZNA KAPIJA LIGHT,"Na privatnom objektu u okolini Beograda, tim Palisada DOO postavio je kliznu kapiju LIGHT, izrađenu od čeličnih toplocinkovanih profila…",2026-06-11T15:52:52.179Z,2026-06-23T20:31:29.508Z,privatni 
838,KLIZNA KAPIJA STANDARD,,klizna-kapija-standard,published,2025-09-24T08:00:00.000Z,gotovi-projekti,"Na privatnom objektu postavljena je klizna kapija STANDARD, izrađena od čeličnih toplocinkovanih profila, dodatno zaštićenih plastifikacijom u boji RAL7016 (antracit siva). Ovaj tip kapije ističe se…",,"Na privatnom objektu postavljena je klizna kapija STANDARD, izrađena od čeličnih toplocinkovanih profila, dodatno zaštićenih plastifikacijom u boji RAL7016 (antracit siva). Ovaj tip kapije ističe se dugotrajnošću, stabilnošću i modernim izgledom, a posebno je pogodan za objekte gde je potrebna funkcionalna i pouzdana zaštita.
Karakteristike klizne kapije STANDARD
 Materijal: Konstrukcija je izrađena od toplocinkovanih čeličnih profila, dodatno plastificiranih za otpornost na spoljne uticaje i koroziju. 
 Boja: Kapija je završno obrađena u nijansi RAL7016 antracit siva, koja se savršeno uklapa uz različite arhitektonske stilove. 
 Stabilnost: Klizni sistem kapije obezbeđuje jednostavno otvaranje i zatvaranje, uz minimalno održavanje. 
 Klizna kapija STANDARD 
Oprema i dodaciZa sve tipove kapija u ponudi Palisada DOO koristi najkvalitetnije elemente evropskog porekla – točkiće, šine, vođice, rolere i ostalu opremu renomiranih proizvođača iz Italije i Belgije. Ovi dodaci garantuju dug vek trajanja i pouzdan rad kapije u svakodnevnoj upotrebi.
 Oprema i dodaci 
AutomatizacijaKapije STANDARD mogu biti u potpunosti automatizovane motorima KING GATES, proizvedenim u Italiji. Za ovu vrstu kapija najčešće se preporučuje motorni pogon DYNAMOS, poznat po snazi, tihom radu i dugotrajnosti. Automatizacija pruža dodatnu praktičnost i sigurnost, posebno u poslovnim i stambenim objektima.
 Motorni pogon DYNAMOS 
Video prezentacijaPogledajte video prikaz klizne kapije STANDARD na terenu:
Ključne reči :klizna kapija STANDARD, kapija RAL7016, antracit siva kapija, čelična klizna kapija, toplocinkovani profili, plastificirana kapija, KING GATES DYNAMOS, motorna kapija, automatizovana kapija, kapija sa motorom, kapijski okov Italija Belgija, Palisada DOO.",KLIZNA-KAPIJA-CELICNA-STANDARD-4.webp,KLIZNA-KAPIJA-CELICNA-STANDARD-5.webp; KLIZNA-KAPIJA-CELICNA-STANDARD-4.webp; KLIZNA-KAPIJA-CELICNA-STANDARD-3.webp; KLIZNA-KAPIJA-CELICNA-STANDARD-2.webp; KLIZNA-KAPIJA-CELICNA-STANDARD-1.webp,5,https://www.youtube.com/watch?v=Mih5EfwuVmQ,KLIZNA KAPIJA STANDARD,"Na privatnom objektu postavljena je klizna kapija STANDARD, izrađena od čeličnih toplocinkovanih profila, dodatno zaštićenih plastifikacijom u boji RAL7016…",2026-06-11T15:53:19.610Z,2026-06-23T20:31:15.367Z,privatni 
821,KOMBINACIJA EUROFENCE 3D I 2D PANELNE OGRADE,,kombinacija-eurofence-3d-i-doublefence-2d-panelne-ograde,published,2025-11-15T09:08:00.000Z,gotovi-projekti,"Na novom poslovno-industrijskom objektu kompanije Piramida 72 iz Šapca, tim Palisada DOO uspešno je realizovao kompletan sistem ograđivanja, koristeći kombinaciju DOUBLEFENCE 2D i EUROFENCE 3D…",,"Na novom poslovno-industrijskom objektu kompanije Piramida 72 iz Šapca, tim Palisada DOO uspešno je realizovao kompletan sistem ograđivanja, koristeći kombinaciju DOUBLEFENCE 2D i EUROFENCE 3D panelnih ograda, uz ugradnju samonosive kapije STANDARD. Ovakav spoj pruža optimalan nivo bezbednosti, dugotrajnost i profesionalan vizuelni identitet objekta.
DOUBLEFENCE 2D panelna ograda
 Specifikacija: Postavljena je ograda visine 1630 mm, izrađena od čelične žice debljine 8/6/8 mm, plastificirana radi dodatne zaštite i produženog veka trajanja. 
 Montaža: Stubovi su ankerisani za betonski parapet, dok su paneli pričvršćeni INOX spojnicama, koje obezbeđuju izuzetnu čvrstoću i maksimalnu otpornost na koroziju. 
 DOUBLEFENCE 2D panelna ograda 
 INOX spojnica za panelnu ogradu 
EUROFENCE 3D panelna ograda
 Dizajn i funkcionalnost: EUROFENCE 3D ograda postavljena je na delu objekta gde je bilo potrebno obezbediti kombinaciju modernog izgleda i pouzdane zaštite. 
 Montaža: Primena istih INOX spojnica omogućila je uniformnost, stabilnost i dugotrajnost celog sistema. 
 EUROFENCE 3D panelna ograda 
Samonosiva kapija STANDARD
 Izrada: Kapija je izrađena od čeličnih, toplocinkovanih profila i plastificirana u boji RAL7016 – antracit siva, kako bi se savršeno uklopila u izgled panelnih ograda. 
 Automatizacija: Kapija je u potpunosti automatizovana motorom KING GATES DYNAMOS, koji je idealan za frekventne industrijske objekte zahvaljujući pouzdanom, stabilnom i tihom radu. 
 Samonosiva kapija STANDARD 
 Motorni pogon KING GATES DYNAMOS 
Video prezentacijaPogledajte kako izgleda kompletno rešenje ograđivanja na objektu Piramida 72:
Ključne reči :panelna ograda DOUBLEFENCE 2D, EUROFENCE 3D, RAL7016 antracit, INOX spojnica, industrijska ograda, samonosiva kapija STANDARD, KING GATES DYNAMOS, industrijski objekat Šabac, ograđivanje objekta, Palisada DOO.",PANELNA-OGRADA-11.webp,PANELNA-OGRADA-88.webp; PANELNA-OGRADA-9.webp; PANELNA-OGRADA-89.webp; PANELNA-OGRADA-90.webp; PANELNA-OGRADA-91.webp; PANELNA-OGRADA-92.webp; PANELNA-OGRADA-93.webp; PANELNA-OGRADA-94.webp; PANELNA-OGRADA-95.webp,9,https://www.youtube.com/watch?v=WHKSz3kHE9s,KOMBINACIJA EUROFENCE 3D I 2D PANELNE OGRADE,"Na novom poslovno-industrijskom objektu kompanije Piramida 72 iz Šapca, tim Palisada DOO uspešno je realizovao kompletan sistem ograđivanja…",2026-06-11T15:52:36.838Z,2026-06-23T20:31:39.693Z,poslovno-industrijski 
816,KOMBINACIJA EUROFENCE 3D I DOUBLEFENCE 2D PANELNE OGRADE,,kombinacija-eurofence-3d-i-doublefence-2d-panelne-ograde-2,published,2025-12-07T11:06:52.000Z,gotovi-projekti,"Na novom poslovno-industrijskom objektu kompanije Piramida 72 iz Šapca, tim Palisada DOO uspešno je realizovao kompletan projekat ograđivanja kombinacijom DOUBLEFENCE 2D i EUROFENCE 3D panelnih…",,"Na novom poslovno-industrijskom objektu kompanije Piramida 72 iz Šapca, tim Palisada DOO uspešno je realizovao kompletan projekat ograđivanja kombinacijom DOUBLEFENCE 2D i EUROFENCE 3D panelnih ograda, uz ugradnju samonosive kapije STANDARD. Ovim sistemom postignut je visok nivo zaštite, funkcionalnosti i estetske usklađenosti.
Panelne ograde DOUBLEFENCE 2D i EUROFENCE 3D
 DOUBLEFENCE 2D: Postavljena je ograda visine 1630 mm, izrađena od čelične žice debljine 8/6/8 mm, sa završnom plastifikacijom koja osigurava otpornost na koroziju i dugi vek trajanja. Stubovi su ankerisani za betonski parapet, dok su paneli pričvršćeni pomoću INOX spojnica, koje obezbeđuju maksimalnu čvrstoću i zaštitu od vremenskih uticaja. 
 DOUBLEFENCE 2D panelna ograda 
 INOX spojnica za panelnu ogradu 
 EUROFENCE 3D: Deo perimetra ograđen je EUROFENCE 3D panelnom ogradom, poznatom po estetskom dizajnu i visokoj funkcionalnosti, koja se savršeno uklapa u industrijsko okruženje. 
 EUROFENCE 3D panelna ograda 
Samonosiva kapija STANDARD
 Konstrukcija i izgled: Kapija je izrađena od čeličnih toplocinkovanih profila, dodatno plastificirana u boji RAL7016 – antracit siva, što omogućava vizuelno uklapanje sa ogradom i izuzetnu otpornost na spoljne uticaje. 
 Samonosiva kapija STANDARD 
 Automatizacija: Kapija je u potpunosti automatizovana motorom KING GATES DYNAMOS, koji obezbeđuje stabilan, pouzdan i tih rad, idealan za objekte sa frekventnim saobraćajem. 
 Motorni pogon KING GATES DYNAMOS 
Video prezentacijaPogledajte video prikaz ograđivanja poslovno-industrijskog objekta kompanije Piramida 72 u Šapcu:
Ključne reči :DOUBLEFENCE 2D, EUROFENCE 3D, panelna ograda, RAL7016 antracit siva, samonosiva kapija STANDARD, KING GATES DYNAMOS, INOX spojnice, ograda za industrijske objekte, čelična ograda 8/6/8, Palisada DOO, Šabac, industrijsko ograđivanje, automatizovana kapija.",PANELNA-OGRADA-1.webp,PANELNA-OGRADA-80.webp; PANELNA-OGRADA-9.webp; PANELNA-OGRADA-81.webp; PANELNA-OGRADA-82.webp; PANELNA-OGRADA-83.webp; PANELNA-OGRADA-84.webp; PANELNA-OGRADA-85.webp; PANELNA-OGRADA-86.webp; PANELNA-OGRADA-87.webp; PANELNA-OGRADA-11.webp,10,https://www.youtube.com/watch?v=WHKSz3kHE9s,KOMBINACIJA EUROFENCE 3D I DOUBLEFENCE 2D PANELNE OGRADE,"Na novom poslovno-industrijskom objektu kompanije Piramida 72 iz Šapca, tim Palisada DOO uspešno je realizovao kompletan projekat ograđivanja kombinacijom…",2026-06-11T15:52:01.694Z,2026-06-23T20:31:46.586Z,poslovno-industrijski 
911,LIDL SRBIJA – HDG EUROFENCE 3D PANELNA OGRADA,,lidl-srbija-hdg-eurofence-3d-panelna-ograda,published,2025-03-10T10:36:27.000Z,gotovi-projekti,"Za potrebe kompanije LIDL SRBIJA, na distributivnom centru LIDL STARA PAZOVA, postavili smo EUROFENCE 3D toplocinkovanu tzv HDG panelnu ogradu.",,"Postavljanje EUROFENCE 3D toplocinkovane panelne ograde za LIDL SRBIJA – Distributivni centar Stara Pazova
Za potrebe kompanije LIDL SRBIJA, na distributivnom centru u LIDL Stara Pazova, uspješno smo postavili EUROFENCE 3D toplocinkovanu panelnu ogradu, poznatu i kao HDG ograda. Ovaj tip ograde je idealan za ograđivanje poslovnih i industrijskih objekata zbog svoje izdržljivosti i dugotrajnosti.
Toplocinkovana panelna ograda EUROFENCE 3D odlikuje se visokom otpornošću na koroziju, što je ključna prednost kada je u pitanju dugoročna zaštita prostora. Toplocinkovanje omogućava da ograda bude otporna na sve vremenske uslove, pružajući maksimalnu sigurnost i stabilnost.
Pored toplocinkovanja, za dodatnu čvrstinu koristimo naše INOX spojnice, koje dodatno povećavaju otpornost ograde i produžuju njen vek trajanja. Ove spojnice su dizajnirane da osiguraju izdržljivost čak i u najzahtevnijim uslovima.
Ukoliko je potrebno dodatno obezbediti prostor sa višim nivoom sigurnosti, preporučujemo postavljanje bodljikave žice u tri reda, na specijalno dizajnirane stubove koji mogu biti zakrivljeni na jednu ili dve strane, pružajući dodatnu zaštitu. Ovo rešenje je idealno za objekte gde je visok stepen sigurnosti prioritet.
Pružamo kompletnu uslugu isporuke i montaže na celoj teritoriji Srbije i šire, uz sve potrebne betonske radove za pravilnu instalaciju ograde i stubova.",3D-PANELNA-OGRADA-9-scaled.avif,3D-PANELNA-OGRADA-8-2048x1153.avif; 3D-PANELNA-OGRADA-7-2048x1153.avif; 3D-PANELNA-OGRADA-6-2048x1153.avif; 3D-PANELNA-OGRADA-5-2048x1153.avif; 3D-PANELNA-OGRADA-4-2048x1153.avif; 3D-PANELNA-OGRADA-3-2048x1153.avif; 3D-PANELNA-OGRADA-2-2048x1153.avif; 3D-PANELNA-OGRADA-1-2048x1153.avif,8,https://www.youtube.com/watch?v=cpm5Ei6IeSg,LIDL SRBIJA – HDG EUROFENCE 3D PANELNA OGRADA,"Za potrebe kompanije LIDL SRBIJA, na distributivnom centru LIDL STARA PAZOVA, postavili smo EUROFENCE 3D toplocinkovanu tzv HDG panelnu ogradu.",2026-06-11T15:55:58.978Z,2026-06-23T20:29:35.511Z,poslovno-industrijski 
919,Lasersko varenje aluminijumskih kapija,,lasersko-varenje-aluminijumskih-kapija,published,2025-03-10T09:01:41.000Z,gotovi-projekti,TIVOLI aluminijumska ograda je jedna od najtrazenijih i najboljih aluminijumskih ograda koje skrivaju unutrasnjost od nepozeljnih pogleda s vana. Od ovih aluminijumskih profila se mogu praviti i sve…,,"Varenje aluminijuma nije jednostavan posao. Uz dobre aparate ide lakše.
Ovde možete videti kako pravimo aluminijumsku pešačku kapiju u ramu sa kutijama 60×60 a ispuna je žaluzina ili tkz. “Z” profil.
Aluminijumska Pešačka kapija , Aluminijumska klizna kapija
Uz aluminijumske kapije idu i šarke od aluminijuma od kompanije Locinox, Locinox dodaci . Model i tip šarke zavisi od veličine i težine kapije.
Sve naše čelične i aluminijumske kapije i ograde možete videti i direktno na našem sajtu…",lasersko-varenje-aluminijumskih-kapija.webp,lasersko-varenje-aluminijumskih-kapija05-scaled.webp; lasersko-varenje-aluminijumskih-kapija02-scaled.webp; lasersko-varenje-aluminijumskih-kapija03-scaled.webp; lasersko-varenje-aluminijumskih-kapija04-scaled.webp,4,https://www.youtube.com/watch?v=H2gf92v5cLY,Lasersko varenje aluminijumskih kapija,Ovde možete videti kako pravimo aluminijumsku pešačku kapiju u ramu sa kutijama 60×60 a ispuna je žaluzina ili tkz. “Z” profil.,2026-06-11T15:56:13.332Z,2026-06-23T20:29:24.651Z,poslovno-industrijski 
853,MODUL CROSS BARIJERA,,modul-cross-barijera,published,2025-07-07T12:39:31.000Z,gotovi-projekti,"Kompanija PALISADA DOO, vodeći stručnjak u oblasti ograđivanja i kontrole pristupa u Srbiji, implementirala je na jednom od svojih projekata vrhunsku tripod barijeru GOTSCHLICH Modul Cross 2ARM,…",,"Kompanija PALISADA D.O.O., vodeći stručnjak u oblasti ograđivanja i kontrole pristupa u Srbiji, implementirala je na jednom od svojih projekata vrhunsku tripod barijeru GOTSCHLICH Modul Cross 2ARM, specijalno opremljenu za najzahtevnije aplikacije u javnim, komercijalnim i industrijskim objektima.
Karakteristike GOTSCHLICH Modul Cross 2ARM barijere
 Robusna konstrukcija: Svi elementi barijere, uključujući kućište i rotirajuće mehanizme, izrađeni su od visokokvalitetnog nerđajućeg čelika CrNi-Stahl V2A, što garantuje otpornost na habanje i dug radni vek, čak i u uslovima intenzivne eksploatacije. 
 Funkcionalnost: Barijera omogućava obostrano rotiranje, kao i programiranje smera prolaza, u zavisnosti od specifičnih potreba korisnika. Namenjena je kako za zatvorene, tako i za spoljne prostore. 
 Integracija dodatne opreme: U kućište je moguće integrisati sve standardne uređaje za kontrolu pristupa – čitače kartica, QR/bar kod skenere, kao i biometrijske čitače (npr. otisak prsta). 
 Dodatne funkcionalnosti: U ovom modelu integrisano je ESD gazište za razmagnetisavanje obuće (idealno za ESD zone), kao i panik taster, koji omogućava momentalno otpuštanje prolaza u slučaju evakuacije ili druge hitne situacije. 
 Poreklo i kvalitet: Svi delovi ove barijere su 100% proizvedeni u Evropskoj uniji, što garantuje najviši kvalitet i usklađenost sa EU standardima bezbednosti i pouzdanosti. 
Tehničke specifikacije
 Napajanje: 230 V, 50–60 Hz, 50 Wh 
 Radna temperatura: od –40 °C do +50 °C 
 Dimenzije osnove: 275 mm × 550 mm 
 Dužina: 1.225 mm 
 Visina: 1.025 mm 
 Težina: 70 kg 
 Materijal: CrNi-Stahl V2A 
Više informacija o ovom modelu barijere možete pronaći na zvaničnoj stranici proizvoda:Tripod barijera GOTSCHLICH Modul Cross 2ARM
Video prezentaciju funkcionalnosti pogledajte ovde:
Ključne reči :
tripod barijera, Gotschlich barijera, kontrola pristupa, industrijska barijera, sigurnosna barijera, barijera sa ESD gazištem, barijera sa panik tasterom, CrNi-Stahl V2A, barijera za sportske centre, barijera za muzeje, biometrijska barijera, čitač otiska prsta, QR skener barijera, barijera za unutrašnju i spoljašnju upotrebu, EU barijera, Palisada doo, vrhunska kontrola pristupa.",barijera-prolaz-radnika-esg-3.webp,barijera-prolaz-radnika-esg-8.webp; barijera-prolaz-radnika-esg-7.webp; barijera-prolaz-radnika-esg-6.webp; barijera-prolaz-radnika-esg-5.webp; barijera-prolaz-radnika-esg-4.webp; barijera-prolaz-radnika-esg-2.webp; barijera-prolaz-radnika-esg-1.webp,7,https://www.youtube.com/watch?v=hm70_SDXQWg,MODUL CROSS BARIJERA,"Kompanija PALISADA DOO, vodeći stručnjak u oblasti ograđivanja i kontrole pristupa u Srbiji, implementirala je na jednom od svojih projekata vrhunsku tripod…",2026-06-11T15:54:04.507Z,2026-06-23T20:30:54.847Z,poslovno-industrijski 
